no,chapter,speaker,firstlistener,addressees,content,time,place
473,4,Wolfshiem,Gatsby,"['Nick', 'Gatsby']",No?,present,diner
474,4,Gatsby,Wolfshiem,"['Nick', 'Wolfshiem']",This is just a friend. I told you we’d talk about that some other time.,present,diner
475,4,Wolfshiem,Gatsby,"['Nick', 'Gatsby']","I beg your pardon,",present,diner
476,4,Wolfshiem,Gatsby,"['Nick', 'Gatsby']",I had a wrong man.,present,diner
477,4,Gatsby,Nick,"['Nick', 'Wolfshiem']","Look here, old sport,",present,diner
478,4,Gatsby,Nick,"['Nick', 'Wolfshiem']",I’m afraid I made you a little angry this morning in the car.,present,diner
479,4,Nick,Gatsby,"['Wolfshiem', 'Gatsby']","I don’t like mysteries,",present,diner
480,4,Nick,Gatsby,"['Wolfshiem', 'Gatsby']",and I don’t understand why you won’t come out frankly and tell me what you want. Why has it all got to come through Miss Baker?,present,diner
481,4,Gatsby,Nick,"['Nick', 'Wolfshiem']","Oh, it’s nothing underhand,",present,diner
482,4,Gatsby,Nick,"['Nick', 'Wolfshiem']","Miss Baker’s a great sportswoman, you know, and she’d never do anything that wasn’t all right.",present,diner
483,4,Wolfshiem,Nick,['Nick'],"He has to telephone,",present,diner
484,4,Wolfshiem,Nick,['Nick'],"Fine fellow, isn’t he? Handsome to look at and a perfect gentleman.",present,diner
485,4,Nick,Wolfshiem,['Wolfshiem'],Yes.,present,diner
486,4,Wolfshiem,Nick,['Nick'],He’s an Oggsford man.,present,diner
487,4,Nick,Wolfshiem,['Wolfshiem'],Oh!,present,diner
488,4,Wolfshiem,Nick,['Nick'],He went to Oggsford College in England. You know Oggsford College?,present,diner
489,4,Nick,Wolfshiem,['Wolfshiem'],I’ve heard of it.,present,diner
490,4,Wolfshiem,Nick,['Nick'],It’s one of the most famous colleges in the world.,present,diner
491,4,Nick,Wolfshiem,['Wolfshiem'],Have you known Gatsby for a long time?,present,diner
492,4,Wolfshiem,Nick,['Nick'],"Several years,",present,diner
493,4,Wolfshiem,Nick,['Nick'],I made the pleasure of his acquaintance just after the war. But I knew I had discovered a man of fine breeding after I talked with him an hour. I said to myself: ‘There’s the kind of man you’d like to take home and introduce to your mother and sister.’,present,diner
494,4,Wolfshiem,Nick,['Nick'],I see you’re looking at my cuff buttons.,present,diner
495,4,Wolfshiem,Nick,['Nick'],"Finest specimens of human molars,",present,diner
496,4,Nick,Wolfshiem,['Wolfshiem'],Well!,present,diner
497,4,Nick,Wolfshiem,['Wolfshiem'],That’s a very interesting idea.,present,diner
498,4,Wolfshiem,Nick,['Nick'],Yeah.,present,diner
499,4,Wolfshiem,Nick,['Nick'],"Yeah, Gatsby’s very careful about women. He would never so much as look at a friend’s wife.",present,diner
500,4,Wolfshiem,Gatsby,"['Nick', 'Gatsby']","I have enjoyed my lunch,",present,diner
501,4,Wolfshiem,Gatsby,"['Nick', 'Gatsby']",and I’m going to run off from you two young men before I outstay my welcome.,present,diner
502,4,Gatsby,Wolfshiem,"['Nick', 'Wolfshiem']","Don’t hurry Meyer,",present,diner
503,4,Wolfshiem,Gatsby,"['Nick', 'Gatsby']","You’re very polite, but I belong to another generation,",present,diner
504,4,Wolfshiem,Gatsby,"['Nick', 'Gatsby']",You sit here and discuss your sports and your young ladies and your—,present,diner
505,4,Wolfshiem,Gatsby,"['Nick', 'Gatsby']","As for me, I am fifty years old, and I won’t impose myself on you any longer.",present,diner
506,4,Gatsby,Nick,['Nick'],"He becomes very sentimental sometimes,",present,diner
507,4,Gatsby,Nick,['Nick'],This is one of his sentimental days. He’s quite a character around New York—a denizen of Broadway.,present,diner
508,4,Nick,Gatsby,['Gatsby'],"Who is he, anyhow, an actor?",present,diner
509,4,Gatsby,Nick,['Nick'],No.,present,diner
510,4,Nick,Gatsby,['Gatsby'],A dentist?,present,diner
511,4,Gatsby,Nick,['Nick'],"Meyer Wolfshiem? No, he’s a gambler.",present,diner
512,4,Gatsby,Nick,['Nick'],He’s the man who fixed the World’s Series back in 1919.,present,diner
513,4,Nick,Gatsby,['Gatsby'],Fixed the World’s Series?,present,diner
514,4,Nick,Gatsby,['Gatsby'],How did he happen to do that?,present,diner
515,4,Gatsby,Nick,['Nick'],He just saw the opportunity.,present,diner
516,4,Nick,Gatsby,['Gatsby'],Why isn’t he in jail?,present,diner
517,4,Gatsby,Nick,['Nick'],"They can’t get him, old sport. He’s a smart man.",present,diner
518,4,Nick,Gatsby,['Gatsby'],"Come along with me for a minute,",present,diner
519,4,Nick,Gatsby,['Gatsby'],I’ve got to say hello to someone.,present,diner
520,4,Tom,Nick,"['Nick', 'Gatsby']",Where’ve you been?,present,diner
521,4,Tom,Nick,"['Nick', 'Gatsby']",Daisy’s furious because you haven’t called up.,present,diner
522,4,Nick,Tom,"['Tom', 'Gatsby']","This is Mr. Gatsby, Mr. Buchanan.",present,diner
523,4,Tom,Nick,"['Nick', 'Gatsby']","How’ve you been, anyhow?",present,diner
524,4,Tom,Nick,"['Nick', 'Gatsby']",How’d you happen to come up this far to eat?,present,diner
525,4,Nick,Tom,"['Tom', 'Gatsby']",I’ve been having lunch with Mr. Gatsby.,present,diner
526,4,Jordan,Nick,['Nick'],"One October day in nineteen-seventeen——I was walking along from one place to another, half on the sidewalks and half on the lawns. I was happier on the lawns because I had on shoes from England with rubber knobs on the soles that bit into the soft ground. I had on a new plaid skirt also that blew a little in the wind, and whenever this happened the red, white, and blue banners in front of all the houses stretched out stiff and said tut-tut-tut-tut, in a disapproving way. The largest of the banners and the largest of the lawns belonged to Daisy Fay’s house. She was just eighteen, two years older than me, and by far the most popular of all the young girls in Louisville. She dressed in white, and had a little white roadster, and all day long the telephone rang in her house and excited young officers from Camp Taylor demanded the privilege of monopolizing her that night.",present,hotel
527,4,officers,Daisy,['Daisy'],"“Anyways, for an hour!”",past,dhouse
528,4,Jordan,Nick,['Nick'],"When I came opposite her house that morning her white roadster was beside the kerb, and she was sitting in it with a lieutenant I had never seen before. They were so engrossed in each other that she didn’t see me until I was five feet away.",present,hotel
529,4,Daisy,Jordan,['Jordan'],"Hello, Jordan,",past,dhouse
530,4,Daisy,Jordan,['Jordan'],Please come here.,past,dhouse
531,4,Jordan,Nick,['Nick'],"I was flattered that she wanted to speak to me, because of all the older girls I admired her most. She asked me if I was going to the Red Cross to make bandages. I was. Well, then, would I tell them that she couldn’t come that day? The officer looked at Daisy while she was speaking, in a way that every young girl wants to be looked at sometime, and because it seemed romantic to me I have remembered the incident ever since. His name was Jay Gatsby, and I didn’t lay eyes on him again for over four years—even after I’d met him on Long Island I didn’t realize it was the same man. That was nineteen-seventeen. By the next year I had a few beaux myself, and I began to play in tournaments, so I didn’t see Daisy very often. She went with a slightly older crowd—when she went with anyone at all. Wild rumours were circulating about her—how her mother had found her packing her bag one winter night to go to New York and say goodbye to a soldier who was going overseas. She was effectually prevented, but she wasn’t on speaking terms with her family for several weeks. After that she didn’t play around with the soldiers any more, but only with a few flat-footed, shortsighted young men in town, who couldn’t get into the army at all. By the next autumn she was gay again, gay as ever. She had a début after the armistice, and in February she was presumably engaged to a man from New Orleans. In June she married Tom Buchanan of Chicago, with more pomp and circumstance than Louisville ever knew before. He came down with a hundred people in four private cars, and hired a whole floor of the Muhlbach Hotel, and the day before the wedding he gave her a string of pearls valued at three hundred and fifty thousand dollars. I was a bridesmaid. I came into her room half an hour before the bridal dinner, and found her lying on her bed as lovely as the June night in her flowered dress—and as drunk as a monkey. She had a bottle of Sauterne in one hand and a letter in the other.",present,hotel
532,4,Daisy,Jordan,['Jordan'],"’Gratulate me,",past,dhouse
533,4,Daisy,Jordan,['Jordan'],"Never had a drink before, but oh how I do enjoy it.",past,dhouse
534,4,Jordan,Daisy,['Daisy'],"What’s the matter, Daisy?",past,dhouse
535,4,Daisy,Jordan,['Jordan'],"Here, dearies.",past,dhouse
536,4,Daisy,Jordan,['Jordan'],Take ’em downstairs and give ’em back to whoever they belong to. Tell ’em all Daisy’s change’ her mine. Say: ‘Daisy’s change’ her mine!’,past,dhouse
537,4,Jordan,Daisy,['Nick'],She groped around in a wastebasket she had with her on the bed and pulled out the string of pearls.,present,hotel
538,4,Jordan,Nick,['Nick'],"She began to cry—she cried and cried. I rushed out and found her mother’s maid, and we locked the door and got her into a cold bath. She wouldn’t let go of the letter. She took it into the tub with her and squeezed it up in a wet ball, and only let me leave it in the soap-dish when she saw that it was coming to pieces like snow. But she didn’t say another word. We gave her spirits of ammonia and put ice on her forehead and hooked her back into her dress, and half an hour later, when we walked out of the room, the pearls were around her neck and the incident was over. Next day at five o’clock she married Tom Buchanan without so much as a shiver, and started off on a three months’ trip to the South Seas. I saw them in Santa Barbara when they came back, and I thought I’d never seen a girl so mad about her husband. If he left the room for a minute she’d look around uneasily, and say:",present,hotel
539,4,Daisy,none,['Jordan'],Where’s Tom gone?,past,thouse
540,4,Jordan,Nick,['Nick'],"and wear the most abstracted expression until she saw him coming in the door. She used to sit on the sand with his head in her lap by the hour, rubbing her fingers over his eyes and looking at him with unfathomable delight. It was touching to see them together—it made you laugh in a hushed, fascinated way. That was in August. A week after I left Santa Barbara Tom ran into a wagon on the Ventura road one night, and ripped a front wheel off his car. The girl who was with him got into the papers, too, because her arm was broken—she was one of the chambermaids in the Santa Barbara Hotel. The next April Daisy had her little girl, and they went to France for a year. I saw them one spring in Cannes, and later in Deauville, and then they came back to Chicago to settle down. Daisy was popular in Chicago, as you know. They moved with a fast crowd, all of them young and rich and wild, but she came out with an absolutely perfect reputation. Perhaps because she doesn’t drink. It’s a great advantage not to drink among hard-drinking people. You can hold your tongue and, moreover, you can time any little irregularity of your own so that everybody else is so blind that they don’t see or care. Perhaps Daisy never went in for amour at all—and yet there’s something in that voice of hers… Well, about six weeks ago, she heard the name Gatsby for the first time in years. It was when I asked you—do you remember?—if you knew Gatsby in West Egg. After you had gone home she came into my room and woke me up, and said:",present,hotel
541,4,Daisy,Jordan,['Jordan'],What Gatsby?,past,thouse
542,4,Jordan,Nick,['Nick'],and when I described him—I was half asleep—she said in the strangest voice that it must be the man she used to know. It wasn’t until then that I connected this Gatsby with the officer in her white car.,present,hotel
543,4,Nick,Jordan,['Jordan'],"It was a strange coincidence,",present,hotel
544,4,Jordan,Nick,['Nick'],But it wasn’t a coincidence at all.,present,hotel
545,4,Nick,Jordan,['Jordan'],Why not?,present,hotel
546,4,Jordan,Nick,['Nick'],Gatsby bought that house so that Daisy would be just across the bay.,present,hotel
547,4,Jordan,Nick,['Nick'],"He wants to know,",present,hotel
548,4,Jordan,Nick,['Nick'],if you’ll invite Daisy to your house some afternoon and then let him come over.,present,hotel
549,4,Nick,Jordan,['Jordan'],Did I have to know all this before he could ask such a little thing?,present,hotel
550,4,Jordan,Nick,['Nick'],"He’s afraid, he’s waited so long. He thought you might be offended. You see, he’s regular tough underneath it all.",present,hotel
551,4,Nick,Jordan,['Jordan'],Why didn’t he ask you to arrange a meeting?,present,hotel
552,4,Jordan,Nick,['Nick'],"He wants her to see his house,",present,hotel
553,4,Jordan,Nick,['Nick'],And your house is right next door.,present,hotel
554,4,Nick,Jordan,['Jordan'],Oh!,present,hotel
555,4,Jordan,Nick,['Nick'],"I think he half expected her to wander into one of his parties, some night,",present,hotel
556,4,Jordan,Nick,['Nick'],"but she never did. Then he began asking people casually if they knew her, and I was the first one he found. It was that night he sent for me at his dance, and you should have heard the elaborate way he worked up to it. Of course, I immediately suggested a luncheon in New York—and I thought he’d go mad:",present,hotel
557,4,Gatsby,Jordan,['Jordan'],I don’t want to do anything out of the way!,past,hotel
558,4,Gatsby,Jordan,['Jordan'],I want to see her right next door.,past,hotel
559,4,Jordan,Nick,['Nick'],"When I said you were a particular friend of Tom’s, he started to abandon the whole idea. He doesn’t know very much about Tom, though he says he’s read a Chicago paper for years just on the chance of catching a glimpse of Daisy’s name.",present,hotel
560,4,Jordan,Nick,['Nick'],"And Daisy ought to have something in her life,",present,hotel
561,4,Nick,Jordan,['Jordan'],Does she want to see Gatsby?,present,hotel
562,4,Jordan,Nick,['Nick'],She’s not to know about it. Gatsby doesn’t want her to know. You’re just supposed to invite her to tea.,present,hotel
563,5,Nick,Gatsby,['Gatsby'],"Your place looks like the World’s Fair,",present,ghouse
564,5,Gatsby,Nick,['Nick'],Does it?,present,ghouse
565,5,Gatsby,Nick,['Nick'],"I have been glancing into some of the rooms. Let’s go to Coney Island, old sport. In my car.",present,ghouse
566,5,Nick,Gatsby,['Gatsby'],It’s too late.,present,ghouse
567,5,Gatsby,Nick,['Nick'],"Well, suppose we take a plunge in the swimming pool? I haven’t made use of it all summer.",present,ghouse
568,5,Nick,Gatsby,['Gatsby'],I’ve got to go to bed.,present,ghouse
569,5,Gatsby,Nick,['Nick'],All right.,present,ghouse
570,5,Nick,Gatsby,['Gatsby'],"I talked with Miss Baker,",present,ghouse
571,5,Nick,Gatsby,['Gatsby'],I’m going to call up Daisy tomorrow and invite her over here to tea.,present,ghouse
572,5,Gatsby,Nick,['Nick'],"Oh, that’s all right,",present,ghouse
573,5,Gatsby,Nick,['Nick'],I don’t want to put you to any trouble.,present,ghouse
574,5,Nick,Gatsby,['Gatsby'],What day would suit you?,present,ghouse
575,5,Gatsby,Nick,['Nick'],What day would suit you?,present,ghouse
576,5,Gatsby,Nick,['Nick'],"I don’t want to put you to any trouble, you see.",present,ghouse
577,5,Nick,Gatsby,['Gatsby'],How about the day after tomorrow?,present,ghouse
578,5,Gatsby,Nick,['Nick'],"I want to get the grass cut,",present,ghouse
579,5,Gatsby,Nick,['Nick'],"There’s another little thing,",present,ghouse
580,5,Nick,Gatsby,['Gatsby'],Would you rather put it off for a few days?,present,ghouse
581,5,Gatsby,Nick,['Nick'],"Oh, it isn’t about that. At least—",present,ghouse
582,5,Gatsby,Nick,['Nick'],"Why, I thought—why, look here, old sport, you don’t make much money, do you?",present,ghouse
583,5,Nick,Gatsby,['Gatsby'],Not very much.,present,ghouse
584,5,Gatsby,Nick,['Nick'],"I thought you didn’t, if you’ll pardon my—you see, I carry on a little business on the side, a sort of side line, you understand. And I thought that if you don’t make very much—You’re selling bonds, aren’t you, old sport?",present,ghouse
585,5,Nick,Gatsby,['Gatsby'],Trying to.,present,ghouse
586,5,Gatsby,Nick,['Nick'],"Well, this would interest you. It wouldn’t take up much of your time and you might pick up a nice bit of money. It happens to be a rather confidential sort of thing.",present,ghouse
587,5,Nick,Gatsby,['Gatsby'],"I’ve got my hands full,",present,ghouse
588,5,Nick,Gatsby,['Gatsby'],I’m much obliged but I couldn’t take on any more work.,present,ghouse
589,5,Gatsby,Nick,['Nick'],You wouldn’t have to do any business with Wolfshiem.,present,ghouse
590,5,Nick,Daisy,['Daisy'],"Don’t bring Tom,",present,phone
591,5,Daisy,Nick,['Nick'],What?,present,phone
592,5,Nick,Daisy,['Daisy'],Don’t bring Tom.,present,phone
593,5,Daisy,Nick,['Nick'],Who is ‘Tom’?,present,phone
594,5,Gatsby,Nick,['Nick'],Is everything all right?,present,nhouse
595,5,Nick,Gatsby,['Gatsby'],"The grass looks fine, if that’s what you mean.",present,nhouse
596,5,Gatsby,Nick,['Nick'],What grass?,present,nhouse
597,5,Gatsby,Nick,['Nick'],"Oh, the grass in the yard.",present,nhouse
598,5,Gatsby,Nick,['Nick'],"Looks very good,",present,nhouse
599,5,Gatsby,Nick,['Nick'],One of the papers said they thought the rain would stop about four. I think it was The Journal. Have you got everything you need in the shape of—of tea?,present,nhouse
600,5,Nick,Gatsby,['Gatsby'],Will they do?,present,nhouse
601,5,Gatsby,Nick,['Nick'],"Of course, of course! They’re fine!",present,nhouse
602,5,Gatsby,Nick,['Nick'],… old sport.,present,nhouse
603,5,Nick,Gatsby,['Gatsby'],Why’s that?,present,nhouse
604,5,Gatsby,Nick,['Nick'],Nobody’s coming to tea. It’s too late!,present,nhouse
605,5,Gatsby,Nick,['Nick'],I can’t wait all day.,present,nhouse
606,5,Nick,Gatsby,['Gatsby'],Don’t be silly; it’s just two minutes to four.,present,nhouse
607,5,Daisy,Nick,['Nick'],"Is this absolutely where you live, my dearest one?",present,nhouse
608,5,Daisy,Nick,['Nick'],"Are you in love with me,",present,nhouse
609,5,Daisy,Nick,['Nick'],or why did I have to come alone?,present,nhouse
610,5,Nick,Daisy,['Daisy'],That’s the secret of Castle Rackrent. Tell your chauffeur to go far away and spend an hour.,present,nhouse
611,5,Daisy,Ferdie,"['Ferdie', 'Nick']","Come back in an hour, Ferdie.",present,nhouse
612,5,Daisy,Nick,['Nick'],His name is Ferdie.,present,nhouse
613,5,Nick,Daisy,['Daisy'],Does the gasoline affect his nose?,present,nhouse
614,5,Daisy,Nick,['Nick'],"I don’t think so,",present,nhouse
615,5,Daisy,Nick,['Nick'],Why?,present,nhouse
616,5,Nick,Daisy,['Daisy'],"Well, that’s funny,",present,nhouse
617,5,Daisy,Nick,['Nick'],What’s funny?,present,nhouse
618,5,Daisy,Gatsby,['Gatsby'],I certainly am awfully glad to see you again.,present,nhouse
619,5,Gatsby,Daisy,['Daisy'],"We’ve met before,",present,nhouse
620,5,Gatsby,Nick,"['Nick', 'Daisy']","I’m sorry about the clock,",present,nhouse
621,5,Nick,Gatsby,"['Gatsby', 'Daisy]","It’s an old clock,",present,nhouse
622,5,Daisy,Gatsby,"['Gatsby', 'Nick']","We haven’t met for many years,",present,nhouse
623,5,Gatsby,Daisy,"['Nick', 'Daisy']",Five years next November.,present,nhouse
624,5,Gatsby,Nick,"['Nick', 'Daisy']",Where are you going?,present,nhouse
625,5,Nick,Gatsby,"['Gatsby', 'Daisy]",I’ll be back.,present,nhouse
626,5,Gatsby,Nick,"['Nick', 'Daisy']",I’ve got to speak to you about something before you go.,present,nhouse
627,5,Gatsby,Nick,['Nick'],"Oh, God!",present,nhouse
628,5,Nick,Gatsby,['Gatsby'],What’s the matter?,present,nhouse
629,5,Gatsby,Nick,['Nick'],"This is a terrible mistake,",present,nhouse
630,5,Gatsby,Nick,['Nick'],"a terrible, terrible mistake.",present,nhouse
631,5,Nick,Gatsby,['Gatsby'],"You’re just embarrassed, that’s all,",present,nhouse
632,5,Nick,Gatsby,['Gatsby'],Daisy’s embarrassed too.,present,nhouse
633,5,Gatsby,Nick,['Nick'],She’s embarrassed?,present,nhouse
634,5,Nick,Gatsby,['Gatsby'],Just as much as you are.,present,nhouse
635,5,Gatsby,Nick,['Nick'],Don’t talk so loud.,present,nhouse
636,5,Nick,Gatsby,['Gatsby'],"You’re acting like a little boy,",present,nhouse
637,5,Nick,Gatsby,['Gatsby'],"Not only that, but you’re rude. Daisy’s sitting in there all alone.",present,nhouse
638,5,Gatsby,Nick,"['Nick', 'Daisy']","Oh, hello, old sport,",present,nhouse
639,5,Nick,Gatsby,"['Gatsby', 'Daisy]",It’s stopped raining.,present,nhouse
640,5,Gatsby,Nick,"['Nick', 'Daisy']",Has it?,present,nhouse
641,5,Gatsby,Daisy,"['Nick', 'Daisy']",What do you think of that? It’s stopped raining.,present,nhouse
642,5,Daisy,Gatsby,"['Gatsby', 'Nick']","I’m glad, Jay.",present,nhouse
643,5,Gatsby,Nick,"['Nick', 'Daisy']","I want you and Daisy to come over to my house,",present,nhouse
644,5,Gatsby,Nick,"['Nick', 'Daisy']",I’d like to show her around.,present,nhouse
645,5,Nick,Gatsby,"['Gatsby', 'Daisy]",You’re sure you want me to come?,present,nhouse
646,5,Gatsby,Nick,"['Nick', 'Daisy']","Absolutely, old sport.",present,nhouse
647,5,Gatsby,Nick,['Nick'],"My house looks well, doesn’t it?",present,nhouse
648,5,Gatsby,Nick,['Nick'],See how the whole front of it catches the light.,present,nhouse
649,5,Gatsby,Nick,['Nick'],Yes.,present,nhouse
650,5,Gatsby,Nick,['Nick'],It took me just three years to earn the money that bought it.,present,nhouse
651,5,Nick,Gatsby,['Gatsby'],I thought you inherited your money.,present,nhouse
652,5,Gatsby,Nick,['Nick'],"I did, old sport,",present,nhouse
653,5,Gatsby,Nick,['Nick'],but I lost most of it in the big panic—the panic of the war.,present,nhouse
654,5,Gatsby,Nick,['Nick'],"That’s my affair,",present,nhouse
655,5,Gatsby,Nick,['Nick'],"Oh, I’ve been in several things,",present,nhouse
656,5,Gatsby,Nick,['Nick'],I was in the drug business and then I was in the oil business. But I’m not in either one now.,present,nhouse
657,5,Gatsby,Nick,['Nick'],Do you mean you’ve been thinking over what I proposed the other night?,present,nhouse
658,5,Daisy,Gatsby,"['Gatsby', 'Nick']",That huge place there?,present,nhouse
659,5,Gatsby,Daisy,"['Nick', 'Daisy']",Do you like it?,present,nhouse
660,5,Daisy,Gatsby,"['Gatsby', 'Nick']","I love it, but I don’t see how you live there all alone.",present,nhouse
661,5,Gatsby,Daisy,"['Nick', 'Daisy']","I keep it always full of interesting people, night and day. People who do interesting things. Celebrated people.",present,nhouse
662,5,Gatsby,Nick,"['Nick', 'Daisy']","It’s the funniest thing, old sport,",present,ghouse
663,5,Gatsby,Nick,"['Nick', 'Daisy']",I can’t—When I try to—,present,ghouse
664,5,Gatsby,Daisy,"['Nick', 'Daisy']","I’ve got a man in England who buys me clothes. He sends over a selection of things at the beginning of each season, spring and fall.",present,ghouse
665,5,Daisy,Gatsby,"['Gatsby', 'Nick']","They’re such beautiful shirts,",present,ghouse
666,5,Daisy,Gatsby,"['Gatsby', 'Nick']",It makes me sad because I’ve never seen such—such beautiful shirts before.,present,ghouse
667,5,Gatsby,Daisy,"['Nick', 'Daisy']","If it wasn’t for the mist we could see your home across the bay,",present,ghouse
668,5,Gatsby,Daisy,"['Nick', 'Daisy']",You always have a green light that burns all night at the end of your dock.,present,ghouse
669,5,Nick,Gatsby,"['Gatsby', 'Daisy]",Who’s this?,present,ghouse
670,5,Gatsby,Nick,"['Nick', 'Daisy']","That? That’s Mr. Dan Cody, old sport.",present,ghouse
671,5,Gatsby,Nick,"['Nick', 'Daisy']",He’s dead now. He used to be my best friend years ago.,present,ghouse
672,5,Daisy,Gatsby,"['Gatsby', 'Nick']","I adore it,",present,ghouse
673,5,Daisy,Gatsby,"['Gatsby', 'Nick']",The pompadour! You never told me you had a pompadour—or a yacht.,present,ghouse
674,5,Gatsby,Daisy,"['Nick', 'Daisy']","Look at this,",present,ghouse
675,5,Gatsby,Daisy,"['Nick', 'Daisy']",Here’s a lot of clippings—about you.,present,ghouse
676,5,Gatsby,phone,['phone'],"Yes… Well, I can’t talk now… I can’t talk now, old sport… I said a small town… He must know what a small town is… Well, he’s no use to us if Detroit is his idea of a small town…",present,phone
677,5,Daisy,Gatsby,"['Gatsby', 'Nick']",Come here quick!,present,ghouse
678,5,Daisy,Gatsby,"['Gatsby', 'Nick']","Look at that,",present,ghouse
679,5,Daisy,Gatsby,"['Gatsby', 'Nick']",I’d like to just get one of those pink clouds and put you in it and push you around.,present,ghouse
680,5,Gatsby,Daisy,"['Nick', 'Daisy']","I know what we’ll do,",present,ghouse
681,5,Gatsby,Daisy,"['Nick', 'Daisy']",we’ll have Klipspringer play the piano.,present,ghouse
682,5,Gatsby,Ewing,['Ewing'],Ewing!,present,ghouse
683,5,Daisy,Ewing,"['Gatsby', 'Nick', 'Ewing']",Did we interrupt your exercise?,present,ghouse
684,5,Ewing,Daisy,"['Nick', 'Daisy', 'Gatsby']","I was asleep,",present,ghouse
685,5,Ewing,Daisy,"['Nick', 'Daisy', 'Gatsby']","That is, I’d been asleep. Then I got up…",present,ghouse
686,5,Gatsby,Ewing,"['Nick', 'Daisy', 'Ewing']","Klipspringer plays the piano,",present,ghouse
687,5,Gatsby,Ewing,"['Nick', 'Daisy', 'Ewing']","Don’t you, Ewing, old sport?",present,ghouse
688,5,Ewing,Gatsby,"['Nick', 'Daisy', 'Gatsby']",I don’t play well. I don’t—hardly play at all. I’m all out of prac—,present,ghouse
689,5,Gatsby,Ewing,"['Nick', 'Daisy', 'Ewing']","We’ll go downstairs,",present,ghouse
