no,chapter,speaker,firstlistener,addressees,content,time,place
949,7,MrWilson,Tom,"['Nick', 'Jordan', 'Tom']","I didn’t mean to interrupt your lunch,",present,whouse
950,7,MrWilson,Tom,"['Nick', 'Jordan', 'Tom']","But I need money pretty bad, and I was wondering what you were going to do with your old car.",present,whouse
951,7,Tom,MrWilson,"['Nick', 'Jordan', 'MrWilson']",How do you like this one?,present,whouse
952,7,Tom,MrWilson,"['Nick', 'Jordan', 'MrWilson']",I bought it last week.,present,whouse
953,7,MrWilson,Tom,"['Nick', 'Jordan', 'Tom']","It’s a nice yellow one,",present,whouse
954,7,Tom,MrWilson,"['Nick', 'Jordan', 'MrWilson']",Like to buy it?,present,whouse
955,7,MrWilson,Tom,"['Nick', 'Jordan', 'Tom']","Big chance,",present,whouse
956,7,MrWilson,Tom,"['Nick', 'Jordan', 'Tom']","No, but I could make some money on the other.",present,whouse
957,7,Tom,MrWilson,"['Nick', 'Jordan', 'MrWilson']","What do you want money for, all of a sudden?",present,whouse
958,7,MrWilson,Tom,"['Nick', 'Jordan', 'Tom']",I’ve been here too long. I want to get away. My wife and I want to go West.,present,whouse
959,7,Tom,MrWilson,"['Nick', 'Jordan', 'MrWilson']","Your wife does,",present,whouse
960,7,MrWilson,Tom,"['Nick', 'Jordan', 'Tom']",She’s been talking about it for ten years.,present,whouse
961,7,MrWilson,Tom,"['Nick', 'Jordan', 'Tom']",And now she’s going whether she wants to or not. I’m going to get her away.,present,whouse
962,7,Tom,MrWilson,"['Nick', 'Jordan', 'MrWilson']",What do I owe you?,present,whouse
963,7,MrWilson,Tom,"['Nick', 'Jordan', 'Tom']","I just got wised up to something funny the last two days,",present,whouse
964,7,MrWilson,Tom,"['Nick', 'Jordan', 'Tom']",That’s why I want to get away. That’s why I been bothering you about the car.,present,whouse
965,7,Tom,MrWilson,"['Nick', 'Jordan', 'MrWilson']",What do I owe you?,present,whouse
966,7,MrWilson,Tom,"['Nick', 'Jordan', 'Tom']",Dollar twenty.,present,whouse
967,7,Tom,MrWilson,"['Nick', 'Jordan', 'MrWilson']","I’ll let you have that car,",present,whouse
968,7,Tom,MrWilson,"['Nick', 'Jordan', 'MrWilson']",I’ll send it over tomorrow afternoon.,present,whouse
969,7,Jordan,Tom,"['Nick', 'Tom']","Those big movies around Fiftieth Street are cool,",present,city
970,7,Jordan,Tom,"['Nick', 'Tom']","I love New York on summer afternoons when everyone’s away. There’s something very sensuous about it—overripe, as if all sorts of funny fruits were going to fall into your hands.",present,city
971,7,Daisy,Tom,"['Nick', 'Tom', 'Jordan', 'Gatsby']",Where are we going?,present,city
972,7,Tom,Daisy,"['Nick', 'Daisy', 'Jordan', 'Gatsby']",How about the movies?,present,city
973,7,Daisy,Tom,"['Nick', 'Tom', 'Jordan', 'Gatsby']","It’s so hot,",present,city
974,7,Daisy,Tom,"['Nick', 'Tom', 'Jordan', 'Gatsby']",You go. We’ll ride around and meet you after.,present,city
975,7,Daisy,Tom,"['Nick', 'Tom', 'Jordan', 'Gatsby']",We’ll meet you on some corner. I’ll be the man smoking two cigarettes.,present,city
976,7,Tom,Daisy,"['Nick', 'Daisy', 'Jordan', 'Gatsby']","We can’t argue about it here,",present,city
977,7,Tom,Daisy,"['Nick', 'Daisy', 'Jordan', 'Gatsby']","You follow me to the south side of Central Park, in front of the Plaza.",present,city
978,7,Jordan,Daisy,"['Nick', 'Daisy', 'Gatsby', 'Tom']","It’s a swell suite,",present,city
979,7,Daisy,Jordan,"['Nick', 'Jordan', 'Gatsby', 'Tom']","Open another window,",present,city
980,7,Jordan,Daisy,"['Nick', 'Daisy', 'Gatsby', 'Tom']",There aren’t any more.,present,city
981,7,Daisy,Jordan,"['Nick', 'Jordan', 'Gatsby', 'Tom']","Well, we’d better telephone for an axe—",present,city
982,7,Tom,Daisy,"['Gatsby', 'Daisy', 'Nick', 'Jordan']","The thing to do is to forget about the heat,",present,city
983,7,Tom,Daisy,"['Gatsby', 'Daisy', 'Nick', 'Jordan']",You make it ten times worse by crabbing about it.,present,city
984,7,Gatsby,Tom,"['Nick', 'Jordan', 'Daisy', 'Tom']","Why not let her alone, old sport?",present,city
985,7,Gatsby,Tom,"['Nick', 'Jordan', 'Daisy', 'Tom']",You’re the one that wanted to come to town.,present,city
986,7,Jordan,Nick,"['Nick', 'Daisy', 'Gatsby', 'Tom']",Excuse me,present,city
987,7,Nick,Jordan,"['Jordan', 'Daisy', 'Gatsby', 'Tom']","I’ll pick it up,",present,city
988,7,Gatsby,Nick,"['Nick', 'Jordan', 'Daisy', 'Tom']",I’ve got it.,present,city
989,7,Gatsby,Nick,"['Nick', 'Jordan', 'Daisy', 'Tom']",Hum!,present,city
990,7,Tom,Gatsby,"['Gatsby', 'Daisy', 'Nick', 'Jordan']","That’s a great expression of yours, isn’t it?",present,city
991,7,Gatsby,Tom,"['Nick', 'Jordan', 'Daisy', 'Tom']",What is?,present,city
992,7,Tom,Gatsby,"['Gatsby', 'Daisy', 'Nick', 'Jordan']",All this ‘old sport’ business. Where’d you pick that up?,present,city
993,7,Daisy,Tom,"['Nick', 'Jordan', 'Gatsby', 'Tom']","Now see here, Tom,",present,city
994,7,Daisy,Tom,"['Nick', 'Jordan', 'Gatsby', 'Tom']",if you’re going to make personal remarks I won’t stay here a minute. Call up and order some ice for the mint julep.,present,city
995,7,Jordan,Daisy,"['Nick', 'Daisy', 'Gatsby', 'Tom']",Imagine marrying anybody in this heat!,present,city
996,7,Daisy,Tom,"['Nick', 'Jordan', 'Gatsby', 'Tom']","Still—I was married in the middle of June,",present,city
997,7,Daisy,Tom,"['Nick', 'Jordan', 'Gatsby', 'Tom']","Louisville in June! Somebody fainted. Who was it fainted, Tom?",present,city
998,7,Tom,Daisy,"['Gatsby', 'Daisy', 'Nick', 'Jordan']","Biloxi,",present,city
999,7,Daisy,Tom,"['Nick', 'Jordan', 'Gatsby', 'Tom']","A man named Biloxi. ‘Blocks’ Biloxi, and he made boxes—that’s a fact—and he was from Biloxi, Tennessee.",present,city
1000,7,Jordan,Nick,"['Nick', 'Daisy', 'Gatsby', 'Tom']","They carried him into my house,",present,city
1001,7,Jordan,Nick,"['Nick', 'Daisy', 'Gatsby', 'Tom']","because we lived just two doors from the church. And he stayed three weeks, until Daddy told him he had to get out. The day after he left Daddy died.",present,city
1002,7,Jordan,Nick,"['Nick', 'Daisy', 'Gatsby', 'Tom']",There wasn’t any connection.,present,city
1003,7,Nick,Jordan,"['Jordan', 'Daisy', 'Gatsby', 'Tom']","I used to know a Bill Biloxi from Memphis,",present,city
1004,7,Nick,Jordan,"['Jordan', 'Daisy', 'Gatsby', 'Tom']",That was his cousin. I knew his whole family history before he left. He gave me an aluminium putter that I use today.,present,city
1005,7,Daisy,Jordan,"['Nick', 'Jordan', 'Gatsby', 'Tom']","We’re getting old,",present,city
1006,7,Daisy,Jordan,"['Nick', 'Jordan', 'Gatsby', 'Tom']",If we were young we’d rise and dance.,present,city
1007,7,Jordan,Daisy,"['Nick', 'Daisy', 'Gatsby', 'Tom']","Remember Biloxi,",present,city
1008,7,Jordan,Tom,"['Nick', 'Daisy', 'Gatsby', 'Tom']","Where’d you know him, Tom?",present,city
1009,7,Tom,Jordan,"['Gatsby', 'Daisy', 'Nick', 'Jordan']",Biloxi?,present,city
1010,7,Tom,Jordan,"['Gatsby', 'Daisy', 'Nick', 'Jordan']",I didn’t know him. He was a friend of Daisy’s.,present,city
1011,7,Daisy,Tom,"['Nick', 'Jordan', 'Gatsby', 'Tom']","He was not,",present,city
1012,7,Daisy,Tom,"['Nick', 'Jordan', 'Gatsby', 'Tom']",I’d never seen him before. He came down in the private car.,present,city
1013,7,Tom,Daisy,"['Gatsby', 'Daisy', 'Nick', 'Jordan']","Well, he said he knew you. He said he was raised in Louisville. Asa Bird brought him around at the last minute and asked if we had room for him.",present,city
1014,7,Jordan,Tom,"['Nick', 'Daisy', 'Gatsby', 'Tom']",He was probably bumming his way home. He told me he was president of your class at Yale.,present,city
1015,7,Tom,Jordan,"['Gatsby', 'Daisy', 'Nick', 'Jordan']",Biloxi?,present,city
1016,7,Tom,Jordan,"['Gatsby', 'Daisy', 'Nick', 'Jordan']","First place, we didn’t have any president—",present,city
1017,7,Tom,Gatsby,"['Gatsby', 'Daisy', 'Nick', 'Jordan']","By the way, Mr. Gatsby, I understand you’re an Oxford man.",present,city
1018,7,Gatsby,Tom,"['Nick', 'Jordan', 'Daisy', 'Tom']",Not exactly.,present,city
1019,7,Tom,Gatsby,"['Gatsby', 'Daisy', 'Nick', 'Jordan']","Oh, yes, I understand you went to Oxford.",present,city
1020,7,Gatsby,Tom,"['Nick', 'Jordan', 'Daisy', 'Tom']",Yes—I went there.,present,city
1021,7,Tom,Gatsby,"['Gatsby', 'Daisy', 'Nick', 'Jordan']",You must have gone there about the time Biloxi went to New Haven.,present,city
1022,7,waiter,Gatsby,"['Gatsby', 'Daisy', 'Nick', 'Jordan', 'Tom']",thank you,present,city
1023,7,Gatsby,Tom,"['Nick', 'Jordan', 'Daisy', 'Tom']","I told you I went there,",present,city
1024,7,Tom,Gatsby,"['Gatsby', 'Daisy', 'Nick', 'Jordan']","I heard you, but I’d like to know when.",present,city
1025,7,Gatsby,Tom,"['Nick', 'Jordan', 'Daisy', 'Tom']","It was in nineteen-nineteen, I only stayed five months. That’s why I can’t really call myself an Oxford man.",present,city
1026,7,Gatsby,Tom,"['Nick', 'Jordan', 'Daisy', 'Tom']","It was an opportunity they gave to some of the officers after the armistice,",present,city
1027,7,Gatsby,Tom,"['Nick', 'Jordan', 'Daisy', 'Tom']",We could go to any of the universities in England or France.,present,city
1028,7,Daisy,Tom,"['Nick', 'Jordan', 'Gatsby', 'Tom']","Open the whisky, Tom,",present,city
1029,7,Daisy,Tom,"['Nick', 'Jordan', 'Gatsby', 'Tom']",and I’ll make you a mint julep. Then you won’t seem so stupid to yourself… Look at the mint!,present,city
1030,7,Tom,Gatsby,"['Gatsby', 'Daisy', 'Nick', 'Jordan']","Wait a minute,",present,city
1031,7,Tom,Gatsby,"['Gatsby', 'Daisy', 'Nick', 'Jordan']",I want to ask Mr. Gatsby one more question.,present,city
1032,7,Gatsby,Tom,"['Nick', 'Jordan', 'Daisy', 'Tom']","Go on,",present,city
1033,7,Tom,Gatsby,"['Gatsby', 'Daisy', 'Nick', 'Jordan']",What kind of a row are you trying to cause in my house anyhow?,present,city
1034,7,Daisy,Tom,"['Nick', 'Jordan', 'Gatsby', 'Tom']","He isn’t causing a row,",present,city
1035,7,Daisy,Tom,"['Nick', 'Jordan', 'Gatsby', 'Tom']",You’re causing a row. Please have a little self-control.,present,city
1036,7,Tom,Daisy,"['Gatsby', 'Daisy', 'Nick', 'Jordan']",Self-control!,present,city
1037,7,Tom,Daisy,"['Gatsby', 'Daisy', 'Nick', 'Jordan']","I suppose the latest thing is to sit back and let Mr. Nobody from Nowhere make love to your wife. Well, if that’s the idea you can count me out… Nowadays people begin by sneering at family life and family institutions, and next they’ll throw everything overboard and have intermarriage between black and white.",present,city
1038,7,Jordan,Tom,"['Nick', 'Daisy', 'Gatsby', 'Tom']","We’re all white here,",present,city
1039,7,Tom,Daisy,"['Gatsby', 'Daisy', 'Nick', 'Jordan']",I know I’m not very popular. I don’t give big parties. I suppose you’ve got to make your house into a pigsty in order to have any friends—in the modern world.,present,city
1040,7,Gatsby,Tom,"['Nick', 'Jordan', 'Daisy', 'Tom']","I’ve got something to tell you, old sport—",present,city
1041,7,Daisy,Gatsby,"['Nick', 'Jordan', 'Gatsby', 'Tom']",Please don’t!,present,city
1042,7,Daisy,Gatsby,"['Nick', 'Jordan', 'Gatsby', 'Tom']",Please let’s all go home. Why don’t we all go home?,present,city
1043,7,Nick,Tom,"['Jordan', 'Daisy', 'Gatsby', 'Tom']","That’s a good idea,",present,city
1044,7,Nick,Tom,"['Jordan', 'Daisy', 'Gatsby', 'Tom']","Come on, Tom. Nobody wants a drink.",present,city
1045,7,Tom,Gatsby,"['Gatsby', 'Daisy', 'Nick', 'Jordan']",I want to know what Mr. Gatsby has to tell me.,present,city
1046,7,Gatsby,Tom,"['Nick', 'Jordan', 'Daisy', 'Tom']","Your wife doesn’t love you,",present,city
1047,7,Gatsby,Tom,"['Nick', 'Jordan', 'Daisy', 'Tom']",She’s never loved you. She loves me.,present,city
1048,7,Tom,Gatsby,"['Gatsby', 'Daisy', 'Nick', 'Jordan']",You must be crazy!,present,city
1049,7,Gatsby,Tom,"['Nick', 'Jordan', 'Daisy', 'Tom']","She never loved you, do you hear?",present,city
1050,7,Gatsby,Tom,"['Nick', 'Jordan', 'Daisy', 'Tom']","She only married you because I was poor and she was tired of waiting for me. It was a terrible mistake, but in her heart she never loved anyone except me!",present,city
1051,7,Tom,Gatsby,"['Gatsby', 'Daisy', 'Nick', 'Jordan']","Sit down, Daisy,",present,city
1052,7,Tom,Gatsby,"['Gatsby', 'Daisy', 'Nick', 'Jordan']",What’s been going on? I want to hear all about it.,present,city
1053,7,Gatsby,Tom,"['Nick', 'Jordan', 'Daisy', 'Tom']","I told you what’s been going on,",present,city
1054,7,Gatsby,Tom,"['Nick', 'Jordan', 'Daisy', 'Tom']",Going on for five years—and you didn’t know.,present,city
1055,7,Tom,Gatsby,"['Gatsby', 'Daisy', 'Nick', 'Jordan']",You’ve been seeing this fellow for five years?,present,city
1056,7,Gatsby,Tom,"['Nick', 'Jordan', 'Daisy', 'Tom']","Not seeing,",present,city
1057,7,Gatsby,Tom,"['Nick', 'Jordan', 'Daisy', 'Tom']","No, we couldn’t meet. But both of us loved each other all that time, old sport, and you didn’t know. I used to laugh sometimes",present,city
1058,7,Gatsby,Tom,"['Nick', 'Jordan', 'Daisy', 'Tom']",to think that you didn’t know.,present,city
1059,7,Tom,Gatsby,"['Gatsby', 'Daisy', 'Nick', 'Jordan']",Oh—that’s all.,present,city
1060,7,Tom,Gatsby,"['Gatsby', 'Daisy', 'Nick', 'Jordan']",You’re crazy!,present,city
1061,7,Tom,Gatsby,"['Gatsby', 'Daisy', 'Nick', 'Jordan']","I can’t speak about what happened five years ago, because I didn’t know Daisy then—and I’ll be damned if I see how you got within a mile of her unless you brought the groceries to the back door. But all the rest of that’s a God damned lie. Daisy loved me when she married me and she loves me now.",present,city
1062,7,Gatsby,Tom,"['Nick', 'Jordan', 'Daisy', 'Tom']","No,",present,city
1063,7,Tom,Gatsby,"['Gatsby', 'Daisy', 'Nick', 'Jordan']","She does, though. The trouble is that sometimes she gets foolish ideas in her head and doesn’t know what she’s doing.",present,city
1064,7,Tom,Gatsby,"['Gatsby', 'Daisy', 'Nick', 'Jordan']","And what’s more, I love Daisy too. Once in a while I go off on a spree and make a fool of myself, but I always come back, and in my heart I love her all the time.",present,city
1065,7,Daisy,Nick,"['Nick', 'Jordan', 'Gatsby', 'Tom']","You’re revolting,",present,city
1066,7,Daisy,Nick,"['Nick', 'Jordan', 'Gatsby', 'Tom']",Do you know why we left Chicago? I’m surprised that they didn’t treat you to the story of that little spree.,present,city
1067,7,Gatsby,Daisy,"['Nick', 'Jordan', 'Daisy', 'Tom']","Daisy, that’s all over now,",present,city
1068,7,Gatsby,Daisy,"['Nick', 'Jordan', 'Daisy', 'Tom']",It doesn’t matter any more. Just tell him the truth—that you never loved him—and it’s all wiped out forever.,present,city
1069,7,Daisy,Gatsby,"['Nick', 'Jordan', 'Gatsby', 'Tom']",Why—how could I love him—possibly?,present,city
1070,7,Gatsby,Daisy,"['Nick', 'Jordan', 'Daisy', 'Tom']",You never loved him.,present,city
1071,7,Daisy,Gatsby,"['Nick', 'Jordan', 'Gatsby', 'Tom']","I never loved him,",present,city
1072,7,Gatsby,Daisy,"['Nick', 'Jordan', 'Daisy', 'Tom']",Not at Kapiolani?,present,city
1073,7,Daisy,Gatsby,"['Nick', 'Jordan', 'Gatsby', 'Tom']",No.,present,city
1074,7,Gatsby,Daisy,"['Nick', 'Jordan', 'Daisy', 'Tom']",Not that day I carried you down from the Punch Bowl to keep your shoes dry?,present,city
1075,7,Gatsby,Daisy,"['Nick', 'Jordan', 'Daisy', 'Tom']",Daisy?,present,city
1076,7,Daisy,Gatsby,"['Nick', 'Jordan', 'Gatsby', 'Tom']",Please don’t.,present,city
1077,7,Daisy,Gatsby,"['Nick', 'Jordan', 'Gatsby', 'Tom']","There, Jay,",present,city
1078,7,Daisy,Gatsby,"['Nick', 'Jordan', 'Gatsby', 'Tom']","Oh, you want too much!",present,city
1079,7,Daisy,Gatsby,"['Nick', 'Jordan', 'Gatsby', 'Tom']",I love you now—isn’t that enough? I can’t help what’s past.,present,city
1080,7,Daisy,Gatsby,"['Nick', 'Jordan', 'Gatsby', 'Tom']",I did love him once—but I loved you too.,present,city
1081,7,Gatsby,Daisy,"['Nick', 'Jordan', 'Daisy', 'Tom']",You loved me too?,present,city
1082,7,Tom,Gatsby,"['Gatsby', 'Daisy', 'Nick', 'Jordan']","Even that’s a lie,",present,city
1083,7,Tom,Gatsby,"['Gatsby', 'Daisy', 'Nick', 'Jordan']","She didn’t know you were alive. Why—there’s things between Daisy and me that you’ll never know, things that neither of us can ever forget.",present,city
1084,7,Gatsby,Daisy,"['Nick', 'Jordan', 'Daisy', 'Tom']","I want to speak to Daisy alone,",present,city
1085,7,Gatsby,Daisy,"['Nick', 'Jordan', 'Daisy', 'Tom']",She’s all excited now—,present,city
1086,7,Daisy,Gatsby,"['Nick', 'Jordan', 'Gatsby', 'Tom']","Even alone I can’t say I never loved Tom,",present,city
1087,7,Daisy,Gatsby,"['Nick', 'Jordan', 'Gatsby', 'Tom']",It wouldn’t be true.,present,city
1088,7,Tom,Daisy,"['Gatsby', 'Daisy', 'Nick', 'Jordan']","Of course it wouldn’t,",present,city
1089,7,Daisy,Tom,"['Nick', 'Jordan', 'Gatsby', 'Tom']","As if it mattered to you,",present,city
1090,7,Tom,Daisy,"['Gatsby', 'Daisy', 'Nick', 'Jordan']",Of course it matters. I’m going to take better care of you from now on.,present,city
1091,7,Gatsby,Tom,"['Nick', 'Jordan', 'Daisy', 'Tom']","You don’t understand,",present,city
1092,7,Gatsby,Tom,"['Nick', 'Jordan', 'Daisy', 'Tom']",You’re not going to take care of her any more.,present,city
1093,7,Tom,Gatsby,"['Gatsby', 'Daisy', 'Nick', 'Jordan']",I’m not?,present,city
1094,7,Tom,Gatsby,"['Gatsby', 'Daisy', 'Nick', 'Jordan']",Why’s that?,present,city
1095,7,Gatsby,Tom,"['Nick', 'Jordan', 'Daisy', 'Tom']",Daisy’s leaving you.,present,city
1096,7,Tom,Gatsby,"['Gatsby', 'Daisy', 'Nick', 'Jordan']",Nonsense.,present,city
1097,7,Daisy,Tom,"['Nick', 'Jordan', 'Gatsby', 'Tom']","I am, though,",present,city
1098,7,Tom,Gatsby,"['Gatsby', 'Daisy', 'Nick', 'Jordan']",She’s not leaving me!,present,city
1099,7,Tom,Gatsby,"['Gatsby', 'Daisy', 'Nick', 'Jordan']",Certainly not for a common swindler who’d have to steal the ring he put on her finger.,present,city
1100,7,Daisy,Tom,"['Nick', 'Jordan', 'Gatsby', 'Tom']",I won’t stand this!,present,city
1101,7,Daisy,Tom,"['Nick', 'Jordan', 'Gatsby', 'Tom']","Oh, please let’s get out.",present,city
1102,7,Tom,Gatsby,"['Gatsby', 'Daisy', 'Nick', 'Jordan']","Who are you, anyhow?",present,city
1103,7,Tom,Gatsby,"['Gatsby', 'Daisy', 'Nick', 'Jordan']",You’re one of that bunch that hangs around with Meyer Wolfshiem—that much I happen to know. I’ve made a little investigation into your affairs—and I’ll carry it further tomorrow.,present,city
1104,7,Gatsby,Tom,"['Nick', 'Jordan', 'Daisy', 'Tom']","You can suit yourself about that, old sport,",present,city
1105,7,Tom,Gatsby,"['Gatsby', 'Daisy', 'Nick', 'Jordan']",I found out what your ‘drugstores’ were.,present,city
1106,7,Tom,Gatsby,"['Gatsby', 'Daisy', 'Nick', 'Jordan']","He and this Wolfshiem bought up a lot of side-street drugstores here and in Chicago and sold grain alcohol over the counter. That’s one of his little stunts. I picked him for a bootlegger the first time I saw him, and I wasn’t far wrong.",present,city
1107,7,Gatsby,Tom,"['Nick', 'Jordan', 'Daisy', 'Tom']",What about it?,present,city
1108,7,Gatsby,Tom,"['Nick', 'Jordan', 'Daisy', 'Tom']",I guess your friend Walter Chase wasn’t too proud to come in on it.,present,city
1109,7,Gatsby,Tom,"['Nick', 'Jordan', 'Daisy', 'Tom']","And you left him in the lurch, didn’t you? You let him go to jail for a month over in New Jersey. God! You ought to hear Walter on the subject of you.",present,city
1110,7,Gatsby,Tom,"['Nick', 'Jordan', 'Daisy', 'Tom']","He came to us dead broke. He was very glad to pick up some money, old sport.",present,city
1111,7,Tom,Gatsby,"['Gatsby', 'Daisy', 'Nick', 'Jordan']",Don’t you call me ‘old sport’!,present,city
1112,7,Tom,Gatsby,"['Gatsby', 'Daisy', 'Nick', 'Jordan']","Walter could have you up on the betting laws too, but Wolfshiem scared him into shutting his mouth.",present,city
1113,7,Tom,Gatsby,"['Gatsby', 'Daisy', 'Nick', 'Jordan']","That drugstore business was just small change,",present,city
1114,7,Tom,Gatsby,"['Gatsby', 'Daisy', 'Nick', 'Jordan']",but you’ve got something on now that Walter’s afraid to tell me about.,present,city
1115,7,Daisy,Tom,"['Nick', 'Jordan', 'Gatsby', 'Tom']","Please, Tom! I can’t stand this any more.",present,city
1116,7,Tom,Daisy,"['Gatsby', 'Daisy', 'Nick', 'Jordan']","You two start on home, Daisy,",present,city
1117,7,Tom,Daisy,"['Gatsby', 'Daisy', 'Nick', 'Jordan']",In Mr. Gatsby’s car.,present,city
1118,7,Tom,Daisy,"['Gatsby', 'Daisy', 'Nick', 'Jordan']",Go on. He won’t annoy you. I think he realizes that his presumptuous little flirtation is over.,present,city
1119,7,Tom,Nick,"['Jordan', 'Nick']",Want any of this stuff? Jordan?… Nick?,present,city
1120,7,Tom,Nick,"['Jordan', 'Nick']",Nick?,present,city
1121,7,Nick,Tom,"['Jordan', 'Tom']",What?,present,city
1122,7,Tom,Nick,"['Jordan', 'Nick']",Want any?,present,city
1123,7,Nick,Tom,"['Jordan', 'Tom']",No… I just remembered that today’s my birthday.,present,city
1124,7,MrWilson,Michaelis,['Michaelis'],"I’ve got my wife locked in up there,",present,whouse
1125,7,MrWilson,Michaelis,['Michaelis'],"She’s going to stay there till the day after tomorrow, and then we’re going to move away.",present,whouse
1126,7,MrsWilson,MrWilson,['MrWilson'],Beat me!,present,whouse
1127,7,MrsWilson,MrWilson,['MrWilson'],"Throw me down and beat me, you dirty little coward!",present,whouse
1128,7,Tom,Jordan,"['Jordan', 'Nick']",Wreck!,present,whouse
1129,7,Tom,Jordan,"['Jordan', 'Nick']",That’s good. Wilson’ll have a little business at last.,present,whouse
1130,7,Tom,Jordan,"['Jordan', 'Nick']","We’ll take a look,",present,whouse
1131,7,Tom,Jordan,"['Jordan', 'Nick']",just a look.,present,whouse
1132,7,Tom,Jordan,"['Jordan', 'Nick']","There’s some bad trouble here,",present,whouse
1133,7,MrWilson,all,['all'],"Oh, my Ga-od! Oh, my Ga-od! Oh, Ga-od! Oh, my Ga-od!",present,whouse
1134,7,policeman,all,['all'],M-a-v—,present,whouse
1135,7,policeman,all,['all'],—o—,present,whouse
1136,7,Michaelis,policeman,['policeman'],"No, r—",present,whouse
1137,7,Michaelis,policeman,['policeman'],M-a-v-r-o—,present,whouse
1138,7,Tom,policeman,['policeman'],Listen to me!,present,whouse
1139,7,policeman,all,['all'],r—,present,whouse
1140,7,policeman,all,['all'],o—,present,whouse
1141,7,policeman,all,['all'],g—,present,whouse
1142,7,policeman,all,['all'],g—,present,whouse
1143,7,policeman,Tom,['Tom'],"What you want, fella?",present,whouse
1144,7,Tom,policeman,['policeman'],What happened?—that’s what I want to know.,present,whouse
1145,7,policeman,Tom,['Tom'],Auto hit her. Ins’antly killed.,present,whouse
1146,7,Tom,policeman,['policeman'],"Instantly killed,",present,whouse
1147,7,policeman,Tom,['Tom'],She ran out ina road. Son-of-a-bitch didn’t even stopus car.,present,whouse
1148,7,Michaelis,Tom,"['Tom', 'policeman']","There was two cars,",present,whouse
1149,7,Michaelis,Tom,"['Tom', 'policeman']","one comin’, one goin’, see?",present,whouse
1150,7,policeman,Michaelis,"['Michaelis', 'Tom']",Going where?,present,whouse
1151,7,Michaelis,policeman,"['Tom', 'policeman']","One goin’ each way. Well, she",present,whouse
1152,7,Michaelis,policeman,"['Tom', 'policeman']","she ran out there an’ the one comin’ from N’York knock right into her, goin’ thirty or forty miles an hour.",present,whouse
1153,7,policeman,Michaelis,"['Michaelis', 'Tom']",What’s the name of this place here?,present,whouse
1154,7,Michaelis,policeman,"['Tom', 'policeman']",Hasn’t got any name.,present,whouse
1155,7,blackman,policeman,"['Tom', 'policeman', 'Michaelis']","It was a yellow car,",present,whouse
1156,7,blackman,policeman,"['Tom', 'policeman', 'Michaelis']",big yellow car. New.,present,whouse
1157,7,policeman,blackman,"['Michaelis', 'Tom', 'blackman']",See the accident?,present,whouse
1158,7,blackman,policeman,"['Tom', 'policeman', 'Michaelis']","No, but the car passed me down the road, going faster’n forty. Going fifty, sixty.",present,whouse
1159,7,policeman,blackman,"['Michaelis', 'Tom', 'blackman']",Come here and let’s have your name. Look out now. I want to get his name.,present,whouse
1160,7,MrWilson,blackman,"['Michaelis', 'Tom', 'blackman', 'policeman']",You don’t have to tell me what kind of car it was! I know what kind of car it was!,present,whouse
1161,7,Tom,MrWilson,"['Michaelis', 'MrWilson', 'blackman']","You’ve got to pull yourself together,",present,whouse
1162,7,Tom,MrWilson,"['Michaelis', 'MrWilson', 'blackman']","Listen,",present,whouse
1163,7,Tom,MrWilson,"['Michaelis', 'MrWilson', 'blackman']","I just got here a minute ago, from New York. I was bringing you that coupé we’ve been talking about. That yellow car I was driving this afternoon wasn’t mine—do you hear? I haven’t seen it all afternoon.",present,whouse
1164,7,policeman,Tom,"['Michaelis', 'Tom', 'blackman', 'MrWilson']",What’s all that?,present,whouse
1165,7,Tom,policeman,"['Michaelis', 'MrWilson', 'blackman', 'policman']",I’m a friend of his.,present,whouse
1166,7,Tom,policeman,"['Michaelis', 'MrWilson', 'blackman', 'policman']",He says he knows the car that did it… It was a yellow car.,present,whouse
1167,7,policeman,Tom,"['Michaelis', 'Tom', 'blackman', 'MrWilson']",And what colour’s your car?,present,whouse
1168,7,policeman,Tom,"['Michaelis', 'Tom', 'blackman', 'MrWilson']","It’s a blue car, a coupé.",present,whouse
1169,7,Nick,policeman,"['Michaelis', 'Tom', 'blackman', 'MrWilson', 'policeman']","We’ve come straight from New York,",present,whouse
1170,7,policeman,Michaelis,['Michaelis'],"Now, if you’ll let me have that name again correct—",present,whouse
1171,7,Tom,people,['people'],"If somebody’ll come here and sit with him,",present,whouse
1172,7,Tom,Nick,['Nick'],Let’s get out.,present,whouse
